id,conversation_id,created_at,date,time,timezone,user_id,username,name,place,tweet,language,mentions,urls,photos,replies_count,retweets_count,likes_count,hashtags,cashtags,link,retweet,quote_url,video,thumbnail,near,geo,source,user_rt_id,user_rt,retweet_id,reply_to,retweet_date,translate,trans_src,trans_dest
1540382753677627393,1540382753677627393,2022-06-24 10:14:02 Pacific Daylight Time,2022-06-24,10:14:02,-0700,17919972,taylorswift13,Taylor Swift,,"I’m absolutely terrified that this is where we are - that after so many decades of people fighting for women’s rights to their own bodies, today’s decision has stripped us of that.",en,[],[],[],10673,143334,821849,[],[],https://twitter.com/taylorswift13/status/1540382753677627393,False,https://twitter.com/MichelleObama/status/1540345715616006148,0,,,,,,,,[],,,,
1540183725027229703,1540183720845533185,2022-06-23 21:03:09 Pacific Daylight Time,2022-06-23,21:03:09,-0700,17919972,taylorswift13,Taylor Swift,,I wrote this one alone in the middle of the night and then @AaronDessner and I meticulously worked on a sound that we felt would be authentic to the moment when this story takes place. I made a wish that one day you would hear it. ‘Carolina’ is out now 🥺   https://t.co/2xqE0fEr10,en,"[{'screen_name': 'aarondessner', 'name': 'aaron dessner', 'id': '226640985'}]",['http://taylor.lnk.to/Carolina'],[],1784,17915,126515,[],[],https://twitter.com/taylorswift13/status/1540183725027229703,False,,0,,,,,,,,[],,,,
1540183720845533185,1540183720845533185,2022-06-23 21:03:08 Pacific Daylight Time,2022-06-23,21:03:08,-0700,17919972,taylorswift13,Taylor Swift,,"About a year &amp; half ago I wrote a song about the story of a girl who always lived on the outside, looking in. Figuratively &amp; literally. The juxtaposition of her loneliness &amp; independence. Her curiosity &amp; fear all tangled up. Her persisting gentleness &amp; the world’s betrayal of it.  https://t.co/2o1z8Hrht6",en,[],[],[],9075,62584,269363,[],[],https://twitter.com/taylorswift13/status/1540183720845533185,False,,1,https://pbs.twimg.com/ext_tw_video_thumb/1540183648468623360/pu/img/xHEqJJY-HYNZqQTZ.jpg,,,,,,,[],,,,
1529295926057123841,1529295926057123841,2022-05-24 19:58:56 Pacific Daylight Time,2022-05-24,19:58:56,-0700,17919972,taylorswift13,Taylor Swift,,"Filled with rage and grief, and so broken by the murders in Uvalde. By Buffalo, Laguna Woods and so many others. By the ways in which we, as a nation, have become conditioned to unfathomable and unbearable heartbreak. Steve’s words ring so true and cut so deep.",en,[],[],[],4168,52605,375735,[],[],https://twitter.com/taylorswift13/status/1529295926057123841,False,https://twitter.com/warriors/status/1529246789290934272,0,,,,,,,,[],,,,
1485714267269738498,1485714265675812866,2022-01-24 12:40:59 Pacific Standard Time,2022-01-24,12:40:59,-0700,17919972,taylorswift13,Taylor Swift,,PS I wrote this tweet all by myself in case you were wondering 😑,en,[],[],[],11777,83619,738051,[],[],https://twitter.com/taylorswift13/status/1485714267269738498,False,,0,,,,,,,,[],,,,
1485714265675812866,1485714265675812866,2022-01-24 12:40:58 Pacific Standard Time,2022-01-24,12:40:58,-0700,17919972,taylorswift13,Taylor Swift,,@DamonAlbarn I was such a big fan of yours until I saw this. I write ALL of my own songs. Your hot take is completely false and SO damaging. You don’t have to like my songs but it’s really fucked up to try and discredit my writing. WOW.,en,[],[],[],22315,113947,743187,[],[],https://twitter.com/taylorswift13/status/1485714265675812866,False,https://twitter.com/latimes/status/1485693067684319234,0,,,,,,,,[],,,,
1470506710901084162,1470506710901084162,2021-12-13 13:31:35 Pacific Standard Time,2021-12-13,13:31:35,-0700,17919972,taylorswift13,Taylor Swift,,"*don’t say it, don’t say it OKAY I’m saying it:* I’M FEELIN 32. And Alana is feeling 30. Don’t worry we tested everyone! Thank you so much for the birthday wishes, I love you all so much 🥰🥲🎂  https://t.co/X43eHWMlKJ",en,[],[],"['https://pbs.twimg.com/media/FGhKDt8WQAIDLNE.jpg', 'https://pbs.twimg.com/media/FGhKDt6XoAc0ecK.jpg']",31261,100920,623767,[],[],https://twitter.com/taylorswift13/status/1470506710901084162,False,,1,https://pbs.twimg.com/media/FGhKDt8WQAIDLNE.jpg,,,,,,,[],,,,
1463277431700262915,1463277431700262915,2021-11-23 14:45:00 Pacific Standard Time,2021-11-23,14:45:00,-0700,17919972,taylorswift13,Taylor Swift,,"NO PROBLEMS TODAY JUST CHAMPAGNE🥂 I wanted to share this video with you from when @aaron_dessner and I were doing our fittings for the video and there was a piano, so ofc this happened. SO stoked evermore has been honored like this. Congrats to all our fellow nominees #GRAMMYs  https://t.co/e50IShhoe6",en,"[{'screen_name': 'aaron_dessner', 'name': 'aaron dessner', 'id': '2923474228'}]",[],[],13513,83120,411744,['grammys'],[],https://twitter.com/taylorswift13/status/1463277431700262915,False,,1,https://pbs.twimg.com/ext_tw_video_thumb/1463277307431469060/pu/img/dGeRgTa94B8nbsMt.jpg,,,,,,,[],,,,
1462908811107307533,1462908807034679303,2021-11-22 14:20:14 Pacific Standard Time,2021-11-22,14:20:14,-0700,17919972,taylorswift13,Taylor Swift,,"THANK YOU to the team that made All Too Well (the 10 min): The ultimate craftsman of songs that sound epic @jackantonoff, bad ass @Sharp_Stick, @rowedizzle and @lizrose06! Love you all. ♥️",en,"[{'screen_name': 'jackantonoff', 'name': 'jackantonoff', 'id': '414569910'}, {'screen_name': 'sharp_stick', 'name': 'sharp stick', 'id': '582525698'}, {'screen_name': 'rowedizzle', 'name': 'christopher rowe', 'id': '249759105'}, {'screen_name': 'lizrose06', 'name': 'liz rose', 'id': '48583250'}]",[],[],1142,13484,171752,[],[],https://twitter.com/taylorswift13/status/1462908811107307533,False,,0,,,,,,,,[],,,,
1462908809542787072,1462908807034679303,2021-11-22 14:20:14 Pacific Standard Time,2021-11-22,14:20:14,-0700,17919972,taylorswift13,Taylor Swift,,I’m so proud of this song and the memories I have with you guys because of it. You truly chose this one and now you did THIS?! I’m floored. A ten minute song is at the top of the Hot 100.🤯,en,[],[],[],2657,21894,233985,[],[],https://twitter.com/taylorswift13/status/1462908809542787072,False,,0,,,,,,,,[],,,,
1462908807034679303,1462908807034679303,2021-11-22 14:20:13 Pacific Standard Time,2021-11-22,14:20:13,-0700,17919972,taylorswift13,Taylor Swift,,*FERAL SCREECH*,en,[],[],[],7040,43471,368653,[],[],https://twitter.com/taylorswift13/status/1462908807034679303,False,https://twitter.com/billboardcharts/status/1462859512570863621,0,,,,,,,,[],,,,
1461732893852590087,1461732893852590087,2021-11-19 08:27:34 Pacific Standard Time,2021-11-19,08:27:34,-0700,17919972,taylorswift13,Taylor Swift,,"Carole, you and your music mean more to me than I could ever sum up in a speech or a performance. But I TRIED. #RockHall2021 tomorrow at 8pm ET    📷: @GettyImages  https://t.co/XcllXMJAjt",en,"[{'screen_name': 'gettyimages', 'name': 'getty images', 'id': '40297195'}]",[],"['https://pbs.twimg.com/media/FEkeUWxXsA8GWUJ.jpg', 'https://pbs.twimg.com/media/FEkeUWwXwBEBW7y.jpg']",4928,24466,235940,['rockhall2021'],[],https://twitter.com/taylorswift13/status/1461732893852590087,False,,1,https://pbs.twimg.com/media/FEkeUWxXsA8GWUJ.jpg,,,,,,,[],,,,
1461138558962610178,1461138558962610178,2021-11-17 17:05:53 Pacific Standard Time,2021-11-17,17:05:53,-0700,17919972,taylorswift13,Taylor Swift,,One of the saddest songs I’ve ever written just got sadder 🙃Drove up to Long Pond Studios to record All Too Well (Sad Girl Autumn Version) with the besties @aaron_dessner @heyjonlow    https://t.co/UnbELgJGAi  https://t.co/Z1XK2zQkwf,en,"[{'screen_name': 'aaron_dessner', 'name': 'aaron dessner', 'id': '2923474228'}, {'screen_name': 'heyjonlow', 'name': 'jonathan low', 'id': '24830844'}]",['http://taylor.lnk.to/atw-sadgirlautumn'],"['https://pbs.twimg.com/media/FEcBxUPXwAMVfwD.jpg', 'https://pbs.twimg.com/media/FEcBxUFXsAImGa-.jpg']",9407,52891,353605,[],[],https://twitter.com/taylorswift13/status/1461138558962610178,False,,1,https://pbs.twimg.com/media/FEcBxUPXwAMVfwD.jpg,,,,,,,[],,,,
1461094648819167245,1461094648819167245,2021-11-17 14:11:24 Pacific Standard Time,2021-11-17,14:11:24,-0700,17919972,taylorswift13,Taylor Swift,,"So grateful for @Miles_Teller for being the greatest dance partner and friend to me. And @keleighteller, who is the coolest living human on planet earth. The bride was willing to risk it all 🥰🧣  https://t.co/PXHlKCo1iF",en,"[{'screen_name': 'miles_teller', 'name': 'miles teller', 'id': '392447726'}, {'screen_name': 'keleighteller', 'name': 'keleigh teller', 'id': '28521939'}]",[],"['https://pbs.twimg.com/media/FEbZ1ofWUAInR4U.jpg', 'https://pbs.twimg.com/media/FEbZ1okWUAEeB_g.jpg', 'https://pbs.twimg.com/media/FEbZ1ohWUAU7cg-.jpg', 'https://pbs.twimg.com/media/FEbZ1omXoAIn-5t.jpg']",5242,30175,264464,[],[],https://twitter.com/taylorswift13/status/1461094648819167245,False,,1,https://pbs.twimg.com/media/FEbZ1ofWUAInR4U.jpg,,,,,,,[],,,,
1460387539060146177,1460387539060146177,2021-11-15 15:21:36 Pacific Standard Time,2021-11-15,15:21:36,-0700,17919972,taylorswift13,Taylor Swift,,The first ever performance of All Too Well (10 min version) was at the AMC 13 theater in front of 400 fans. We recorded the acoustic performance so now we can all experience it together 🥲 It’s available here  https://t.co/H55gVedcRh  https://t.co/ntDSDI9tYV,en,[],['https://taylor.lnk.to/atw-collection'],"['https://pbs.twimg.com/media/FERWubaWUAU-Hle.jpg', 'https://pbs.twimg.com/media/FERWuXIXwAEdxuQ.jpg']",6284,43770,344032,[],[],https://twitter.com/taylorswift13/status/1460387539060146177,False,,1,https://pbs.twimg.com/media/FERWubaWUAU-Hle.jpg,,,,,,,[],,,,
1460266792023207945,1460266792023207945,2021-11-15 07:21:48 Pacific Standard Time,2021-11-15,07:21:48,-0700,17919972,taylorswift13,Taylor Swift,,The reddest video EVER is out now. Directed by @blakelively who SMASHED it just like I smashed this cake.   https://t.co/Gm4xT1vuNk  https://t.co/G0T66YdzMz,en,"[{'screen_name': 'blakelively', 'name': 'blake lively', 'id': '2678072634'}]",['https://Taylor.lnk.to/IBYTAMVideo'],[],10286,74874,374036,[],[],https://twitter.com/taylorswift13/status/1460266792023207945,False,,1,https://pbs.twimg.com/ext_tw_video_thumb/1460266749413273608/pu/img/_UHLExdm1Cws8wXI.jpg,,,,,,,[],,,,
1459899686945447936,1459899686945447936,2021-11-14 07:03:03 Pacific Standard Time,2021-11-14,07:03:03,-0700,17919972,taylorswift13,Taylor Swift,,"SURPRISE! NEW MUSIC VIDEO TOMORROW at 10am ET 🚨 I finally got to work with the brilliant, brave, &amp; wickedly funny @blakelively on her directorial debut. Join us as we raise a toast, and a little hell.    https://t.co/Gm4xT1vuNk  https://t.co/2Qh7KEVUpD",en,"[{'screen_name': 'blakelively', 'name': 'blake lively', 'id': '2678072634'}]",['https://Taylor.lnk.to/IBYTAMVideo'],[],25838,97756,508595,[],[],https://twitter.com/taylorswift13/status/1459899686945447936,False,,1,https://pbs.twimg.com/ext_tw_video_thumb/1459899669199433737/pu/img/XkDK3k-ON3eXXowJ.jpg,,,,,,,[],,,,
1459698548522508289,1459698548522508289,2021-11-13 17:43:48 Pacific Standard Time,2021-11-13,17:43:48,-0700,17919972,taylorswift13,Taylor Swift,,Loving him was Redd. 😘,en,[],[],[],3053,26392,285886,[],[],https://twitter.com/taylorswift13/status/1459698548522508289,False,https://twitter.com/nbcsnl/status/1459695332074344451,0,,,,,,,,[],,,,
1459698546098282497,1459698546098282497,2021-11-13 17:43:47 Pacific Standard Time,2021-11-13,17:43:47,-0700,17919972,taylorswift13,Taylor Swift,,It’s the 13th and I get to play on @nbcsnl tonight with host Jonathan Majors 😆  https://t.co/YrJGQpZKfR,en,"[{'screen_name': 'nbcsnl', 'name': 'saturday night live - snl', 'id': '28221296'}]",[],[],2391,19198,183455,[],[],https://twitter.com/taylorswift13/status/1459698546098282497,False,,1,https://pbs.twimg.com/ext_tw_video_thumb/1459697908828282882/pu/img/xAYhW7fEzjm8fpXG.jpg,,,,,,,[],,,,
1459640685397745664,1459640685397745664,2021-11-13 13:53:52 Pacific Standard Time,2021-11-13,13:53:52,-0700,17919972,taylorswift13,Taylor Swift,,🤯🤯🤯🤯,art,[],[],[],15397,75979,617150,[],[],https://twitter.com/taylorswift13/status/1459640685397745664,False,https://twitter.com/Spotify/status/1459627501865472001,0,,,,,,,,[],,,,
1459331432803880962,1459331432803880962,2021-11-12 17:25:01 Pacific Standard Time,2021-11-12,17:25:01,-0700,17919972,taylorswift13,Taylor Swift,,"I can’t begin to express my gratitude to Sadie and Dylan for giving us everything they had in order to tell this story. All Too Well The Short Film is out on YouTube, and showing all week at the AMC 13 theater in NYC. For you, from us. ♥️   https://t.co/YzOtPK5Hzd  https://t.co/gniDuc8KlF",en,[],['http://taylor.lnk.to/ATWshortfilm'],"['https://pbs.twimg.com/media/FECWM5BXoAEjOg0.jpg', 'https://pbs.twimg.com/media/FECWM5AXMAMyhdj.jpg', 'https://pbs.twimg.com/media/FECWM5kXwAABFlX.jpg', 'https://pbs.twimg.com/media/FECWM6iXEAon_K2.jpg']",11153,133892,677020,[],[],https://twitter.com/taylorswift13/status/1459331432803880962,False,,1,https://pbs.twimg.com/media/FECWM5BXoAEjOg0.jpg,,,,,,,[],,,,
1459320569246228481,1459320569246228481,2021-11-12 16:41:51 Pacific Standard Time,2021-11-12,16:41:51,-0700,17919972,taylorswift13,Taylor Swift,,🥺🥺♥️♥️,art,[],[],[],10726,63616,515166,[],[],https://twitter.com/taylorswift13/status/1459320569246228481,False,https://twitter.com/dylanobrien/status/1459310194173874176,0,,,,,,,,[],,,,
1459305182790041600,1459305182790041600,2021-11-12 15:40:42 Pacific Standard Time,2021-11-12,15:40:42,-0700,17919972,taylorswift13,Taylor Swift,,Any time now…. (20 minutes til the all too well short film premiere!!!!) #alltoowelltheshortfilm 🧣   https://t.co/YzOtPK5Hzd,en,[],['http://taylor.lnk.to/ATWshortfilm'],[],9085,48929,274966,['alltoowelltheshortfilm'],[],https://twitter.com/taylorswift13/status/1459305182790041600,False,,0,,,,,,,,[],,,,
1459041713209630728,1459041713209630728,2021-11-11 22:13:46 Pacific Standard Time,2021-11-11,22:13:46,-0700,17919972,taylorswift13,Taylor Swift,,I AM ALL TOO UNWELL 🥲,en,[],[],[],14532,69664,504396,[],[],https://twitter.com/taylorswift13/status/1459041713209630728,False,https://twitter.com/RollingStone/status/1459023912046583827,0,,,,,,,,[],,,,
1459023801480474632,1459023801480474632,2021-11-11 21:02:36 Pacific Standard Time,2021-11-11,21:02:36,-0700,17919972,taylorswift13,Taylor Swift,,"It never would have been possible to go back &amp; remake my previous work, uncovering lost art &amp; forgotten gems along the way if you hadn’t emboldened me. Red is about to be mine again, but it has always been ours. Now we begin again. Red (my version) is out   https://t.co/ZUAWDuv4jL  https://t.co/Ji26KdOlWQ",en,[],['https://taylor.lnk.to/redtaylorsversion'],"['https://pbs.twimg.com/media/FD9-aXKWYAATZTm.jpg', 'https://pbs.twimg.com/media/FD9-aXIWYBI4DP6.jpg']",31020,209301,829739,[],[],https://twitter.com/taylorswift13/status/1459023801480474632,False,,1,https://pbs.twimg.com/media/FD9-aXKWYAATZTm.jpg,,,,,,,[],,,,
1458876078525759491,1458876078525759491,2021-11-11 11:15:36 Pacific Standard Time,2021-11-11,11:15:36,-0700,17919972,taylorswift13,Taylor Swift,,This is my last day of life before #RedTaylorsVersion. Midnight. Tonight.  https://t.co/Mgzlx3Qg3z,en,[],[],"['https://pbs.twimg.com/media/FD74Dk0X0AI-VsR.jpg', 'https://pbs.twimg.com/media/FD74Dk5XIAI5pCx.jpg']",22222,137502,652282,['redtaylorsversion'],[],https://twitter.com/taylorswift13/status/1458876078525759491,False,,1,https://pbs.twimg.com/media/FD74Dk0X0AI-VsR.jpg,,,,,,,[],,,,
1458791263193477120,1458791263193477120,2021-11-11 05:38:34 Pacific Standard Time,2021-11-11,05:38:34,-0700,17919972,taylorswift13,Taylor Swift,,"Shot on 35mm film with cinematography by the brilliant @the_rinayang. Plan your watch parties or grab your blanket and curl up into a ball. However you want to watch All Too Well The Short Film, it’ll be out tomorrow on YouTube at 7pm Eastern. 🥲    https://t.co/YzOtPK5Hzd  https://t.co/SWAlziJ6bC",en,"[{'screen_name': 'the_rinayang', 'name': 'rina yang b.s.c', 'id': '46492071'}]",['http://taylor.lnk.to/ATWshortfilm'],['https://pbs.twimg.com/media/FD6q67XXoAMKcyS.jpg'],12913,109786,501585,[],[],https://twitter.com/taylorswift13/status/1458791263193477120,False,,1,https://pbs.twimg.com/media/FD6q67XXoAMKcyS.jpg,,,,,,,[],,,,
1456604921898360843,1456604921898360843,2021-11-05 05:50:50 Pacific Daylight Time,2021-11-05,05:50:50,-0700,17919972,taylorswift13,Taylor Swift,,November 12. Remember it.   @SadieSink  @dylanobrien  https://t.co/fTAd8dItX0,en,"[{'screen_name': 'sadiesink', 'name': 'sadie sink', 'id': '2786266138'}, {'screen_name': 'dylanobrien', 'name': ""dylan o'brien"", 'id': '281766200'}]",[],[],23991,144376,600437,[],[],https://twitter.com/taylorswift13/status/1456604921898360843,False,,1,https://pbs.twimg.com/ext_tw_video_thumb/1456604249022996480/pu/img/4aqlqOyDMSj-wcN8.jpg,,,,,,,[],,,,
1454961583508033542,1454961583508033542,2021-10-31 17:00:48 Pacific Daylight Time,2021-10-31,17:00:48,-0700,17919972,taylorswift13,Taylor Swift,,"can’t talk right now, I’m doin hot squirrel shit 🐿  #halloween2021  #HalloweenTaylorsVersion  https://t.co/N6asoXfGlB",en,[],[],"['https://pbs.twimg.com/media/FDEP10uX0AI7RRg.jpg', 'https://pbs.twimg.com/media/FDEP10xXMAML3j7.jpg']",16467,73234,497866,"['halloween2021', 'halloweentaylorsversion']",[],https://twitter.com/taylorswift13/status/1454961583508033542,False,,1,https://pbs.twimg.com/media/FDEP10uX0AI7RRg.jpg,,,,,,,[],,,,
1448329324365484032,1448329324365484032,2021-10-13 09:46:34 Pacific Daylight Time,2021-10-13,09:46:34,-0700,17919972,taylorswift13,Taylor Swift,,"Darling, let’s run ♥️♥️♥️♥️",en,[],[],[],13667,23195,216782,[],[],https://twitter.com/taylorswift13/status/1448329324365484032,False,https://twitter.com/taylornation13/status/1448317697993891841,0,,,,,,,,[],,,,
1443619878062235650,1443619878062235650,2021-09-30 09:52:54 Pacific Daylight Time,2021-09-30,09:52:54,-0700,17919972,taylorswift13,Taylor Swift,,Got some news that I think you’re gonna like - My version of Red will be out a week earlier than scheduled (including the 4 disc vinyl) on November 12th ! Can’t wait to celebrate the 13th with you and our new/old autumn heartbreak album🧣😍 🎥 🎥   https://t.co/FVp6xizaOG,en,[],['http://redtaylorsversion.taylorswift.com'],[],23633,72663,401842,[],[],https://twitter.com/taylorswift13/status/1443619878062235650,False,,0,,,,,,,,[],,,,
1440046696394682375,1440046696394682375,2021-09-20 13:14:21 Pacific Daylight Time,2021-09-20,13:14:21,-0700,17919972,taylorswift13,Taylor Swift,,"It’s true, I signed them all and it’s also true that I may never write the same again, as my hand is now frozen in the permanent shape of a claw. All for you 😘",en,[],[],[],13024,27418,248248,[],[],https://twitter.com/taylorswift13/status/1440046696394682375,False,https://twitter.com/taylornation13/status/1439937773885079552,0,,,,,,,,[],,,,
1438854975485059077,1438854975485059077,2021-09-17 06:18:53 Pacific Daylight Time,2021-09-17,06:18:53,-0700,17919972,taylorswift13,Taylor Swift,,"Hi! Saw you guys got Wildest Dreams trending on tiktok, thought you should have my version 😘😘😘😘   https://t.co/dZSBbSCcxV  https://t.co/MecFvUPNJb",en,[],['http://taylor.lnk.to/wildestdreamsTV'],['https://pbs.twimg.com/media/E_fW-PVXsAAuSTk.jpg'],33470,118459,529644,[],[],https://twitter.com/taylorswift13/status/1438854975485059077,False,,1,https://pbs.twimg.com/media/E_fW-PVXsAAuSTk.jpg,,,,,,,[],,,,
1436350633943130116,1436292456350457857,2021-09-10 08:27:31 Pacific Daylight Time,2021-09-10,08:27:31,-0700,17919972,taylorswift13,Taylor Swift,,@arloparks @MercuryPrize This is so well deserved. Your album is stunning ❤️❤️❤️❤️,en,[],[],[],2046,3713,30808,[],[],https://twitter.com/taylorswift13/status/1436350633943130116,False,,0,,,,,,,,"[{'screen_name': 'arloparks', 'name': 'Arlo Parks', 'id': '1065590638178168832'}, {'screen_name': 'MercuryPrize', 'name': 'Mercury Prize', 'id': '16114582'}]",,,,
1434358271004094466,1434358271004094466,2021-09-04 20:30:35 Pacific Daylight Time,2021-09-04,20:30:35,-0700,17919972,taylorswift13,Taylor Swift,,"What a beautiful moment, CONGRATULATIONS ANITA!! 🥲🥲👏👏",en,[],[],[],6547,14304,181758,[],[],https://twitter.com/taylorswift13/status/1434358271004094466,False,https://twitter.com/IAMANITABAKER/status/1433849361406910465,0,,,,,,,,[],,,,
1432029787107774465,1432029787107774465,2021-08-29 10:18:01 Pacific Daylight Time,2021-08-29,10:18:01,-0700,17919972,taylorswift13,Taylor Swift,,"I’m blown away by @halsey’s artistry and commitment to taking risks. Giving us all a brave new era to dive into and explore together. If I can’t have love, I want power is out now- please stream and buy the album!!",en,"[{'screen_name': 'halsey', 'name': 'h', 'id': '45709328'}]",[],[],9918,35817,246716,[],[],https://twitter.com/taylorswift13/status/1432029787107774465,False,https://twitter.com/halsey/status/1431107940606382082,0,,,,,,,,[],,,,
1431302774277480454,1431302774277480454,2021-08-27 10:09:08 Pacific Daylight Time,2021-08-27,10:09:08,-0700,17919972,taylorswift13,Taylor Swift,,My buddy @aaron_dessner got us all together to make “how long do you think it’s gonna last?” and it would be very smile-inducing for us if you checked it out. 😘 @BRMadjv    https://t.co/HRJRqFAMPD  https://t.co/kzjgJ2bts7,en,"[{'screen_name': 'aaron_dessner', 'name': 'aaron dessner', 'id': '2923474228'}, {'screen_name': 'brmadjv', 'name': 'big red machine', 'id': '1049757429355999232'}]",['https://linktr.ee/bigredmachine'],['https://pbs.twimg.com/media/E90CSV7XsAAu7Tl.jpg'],4846,18460,143143,[],[],https://twitter.com/taylorswift13/status/1431302774277480454,False,,1,https://pbs.twimg.com/media/E90CSV7XsAAu7Tl.jpg,,,,,,,[],,,,
1429827296060391432,1429827296060391432,2021-08-23 08:26:06 Pacific Daylight Time,2021-08-23,08:26:06,-0700,17919972,taylorswift13,Taylor Swift,,Red (my version) vinyl is up for presale on my site and oh I’m on tiktok now let the games begin 😺 #SwiftTok    https://t.co/qyzr8cv3KS,en,[],['https://vm.tiktok.com/ZMR27FL2v/'],[],12426,32104,197055,['swifttok'],[],https://twitter.com/taylorswift13/status/1429827296060391432,False,,0,,,,,,,,[],,,,
1423645701075046401,1423645698868891648,2021-08-06 07:02:39 Pacific Daylight Time,2021-08-06,07:02:39,-0700,17919972,taylorswift13,Taylor Swift,,"We’ll also be making a bunch of new ones too, since Red (Taylor’s Version) includes so many songs you haven’t heard yet. Till then, I’ll be counting down and picturing it all in my head. In burning red.",en,[],[],[],3164,23594,192541,[],[],https://twitter.com/taylorswift13/status/1423645701075046401,False,,0,,,,,,,,[],,,,
1423645698868891648,1423645698868891648,2021-08-06 07:02:39 Pacific Daylight Time,2021-08-06,07:02:39,-0700,17919972,taylorswift13,Taylor Swift,,"Congrats pals, you guessed the titles and ft. artists on Red (my version). The vault tracks will ft. @ChrisStapleton, @phoebe_bridgers, @mistersmims &amp; @edsheeran❗️I can’t wait to dust off our highest hopes &amp; relive these memories together. Pre-order now  https://t.co/5VduTiOaKB  https://t.co/3BjCzI7Wag",en,"[{'screen_name': 'chrisstapleton', 'name': 'chris stapleton', 'id': '51104447'}, {'screen_name': 'phoebe_bridgers', 'name': 'traitor joe', 'id': '574631672'}, {'screen_name': 'mistersmims', 'name': 'mark foster', 'id': '3854929394'}, {'screen_name': 'edsheeran', 'name': 'ed sheeran hq', 'id': '85452649'}]",['http://Taylor.lnk.to/redtaylorsversion'],['https://pbs.twimg.com/media/E8HONvZWUAEacDi.jpg'],11939,71160,354949,[],[],https://twitter.com/taylorswift13/status/1423645698868891648,False,,1,https://pbs.twimg.com/media/E8HONvZWUAEacDi.jpg,,,,,,,[],,,,
